$$Name$maps__SavedQuery__r.Name,Id,maps__Column1__c,maps__Column2__c,maps__Column3__c,maps__Column4__c,maps__Column5__c,maps__ListLabel__c,maps__NumToDisplay__c,maps__Order__c,maps__ReferenceField__c,maps__RelatedSort__c,maps__SavedQuery__c,maps__SavedQuery__r.$$Name$maps__BaseObject__r.Name$maps__Folder__r.Name,Name
AssignedResource;S2 Dispatched Service Appointments,a2DDG000002nmdz2AA,AssignedResourceNumber,,,,,Assigned Resource (ServiceResources),1,0,ServiceAppointmentId,CreatedDate ASC,a2EDG000001mjRF2AY,S2 Dispatched Service Appointments;ServiceAppointment;Otis Layers,AssignedResource
AssignedResource;S4 Dispatched Service Appointments,a2DDG000002nme92AA,AssignedResourceNumber,,,,,Assigned Resource (ServiceResources),1,0,ServiceAppointmentId,CreatedDate ASC,a2EDG000001mjRP2AY,S4 Dispatched Service Appointments;ServiceAppointment;Otis Layers,AssignedResource
AssignedResource;S1 Dispatched Service Appointments,a2DDG000002nmdu2AA,AssignedResourceNumber,,,,,Assigned Resource (ServiceResources),1,0,ServiceAppointmentId,CreatedDate ASC,a2EDG000001mjRA2AY,S1 Dispatched Service Appointments;ServiceAppointment;Otis Layers,AssignedResource
AssignedResource;S3 Dispatched Service Appointments,a2DDG000002nme42AA,AssignedResourceNumber,,,,,Assigned Resource (ServiceResources),1,0,ServiceAppointmentId,CreatedDate ASC,a2EDG000001mjRK2AY,S3 Dispatched Service Appointments;ServiceAppointment;Otis Layers,AssignedResource
Asset;Buildings with Shutdown Units,a2DDG000002nmbP2AQ,Name,RouteName__c,OperationalStatus__c,OperationalStatusReason__c,,Unit (Assets),10,0,LocationId,CreatedDate ASC,a2EDG000001mjRZ2AY,Buildings with Shutdown Units;Location;Otis Layers,Asset
WorkOrder;Buildings with Shutdown Units,a2DDG000002nmbQ2AQ,WorkOrderNumber,CreatedDate,,,,Work Order (WorkOrders),10,1,LocationId,CreatedDate ASC,a2EDG000001mjRZ2AY,Buildings with Shutdown Units;Location;Otis Layers,WorkOrder
